<?xml version="1.0" encoding="UTF-8"?>
<!DOCTYPE search PUBLIC "-//Ovitas//DTD Compass Base//NO" "compass-base.dtd">
<search>
    <relationtype id="synonym" name="Synonym" weight="1.0" />
    
    <relation type="synonym">
        <topic>
            <name>Stomach</name>
        </topic>
        <topic>
            <name>Abdomen</name>
        </topic>
    </relation>
    <relation type="synonym">
        <topic>
            <name>Happy</name>
        </topic>
        <topic>
            <name>Satisfied</name>
        </topic>
    </relation>
</search>